{
  "schema_version": "field-witness-envelope-v1",
  "route_gradient": {"eligible_routes": ["route-alpha"], "selected": "route-alpha", "reason": "structural fixture selection"},
  "burden_events": [{"event_id": "E1", "burden_id": "B1", "owner_id": "owner-alpha", "result": "recorded"}, {"event_id": "E2", "burden_id": "B2", "owner_id": "owner-beta", "result": "recorded"}],
  "field_diagnostics": {"divergence": "neutral", "curl": "null"},
  "loopbreak": null,
  "reconstruction": {"burden_ids": ["B1", "B2"], "activation_body_refs": ["B1_1", "B2_1"], "status": "reconstructed"},
  "closure": {"derived_decision": "COMPLETE", "closure_confirmed": true},
  "transfer_boundary": {"operator": "T_lang", "mode": "partial_coupling", "uptake_guaranteed": false},
  "register_deltas": [{"register": "xi", "delta_ref": "D1"}],
  "non_claims": ["Audit reconstruction does not establish semantic truth."],
  "provenance": {"evidence_type": "fixture", "source": "tests/witness-artifact-roles/valid/current-triplet", "captured_by": "witness-artifact-roles"},
  "coverage_proof": {"burden_ids": ["B1", "B2"], "activation_count": 2, "lifecycle_count": 2, "structural_only": true},
  "artifact_binding": {
    "schema_version": "field-witness-artifact-binding-v1",
    "canonicalization": "daee-canonical-json-v1",
    "source_commit": "6987c9ebf1de45af700b1fa74b1ed25ec0beeb7c",
    "output_sha256": "6666666666666666666666666666666666666666666666666666666666666666",
    "public_field_witness_sha256": "b05ab912712ee73306951629c74ab4c175493763619bea301be6fe9802d6e470",
    "audit_envelope_projection_sha256": "3af07fb15e47f404d67dda4c2bf70568d9e8057b52953c456e808fed360fe3b0",
    "activation_lifecycle_fingerprint_sha256": "9c371ad35380fcb3920b8a7edcdf01ce7e72c2c2c7a22b5c3751507b0ebb3a13",
    "stage04_projection_sha256": "b5fa26172a50279f2172df230b9cf3eac8d1be1c8da853831807ee08c15ca5ab",
    "stage06_projection_sha256": "60c31bd381af4b291353a8455ef843961948c0c8cfcfb4f65f9f9b86887a1fbd",
    "stage07_projection_sha256": "60c31bd381af4b291353a8455ef843961948c0c8cfcfb4f65f9f9b86887a1fbd",
    "act_rows_hash": "9999999999999999999999999999999999999999999999999999999999999999",
    "nar_hash": "aaaaaaaaaaaaaaaaaaaaaaaaaaaaaaaaaaaaaaaaaaaaaaaaaaaaaaaaaaaaaaaa",
    "owner_activation_ordering_hash": "bbbbbbbbbbbbbbbbbbbbbbbbbbbbbbbbbbbbbbbbbbbbbbbbbbbbbbbbbbbbbbbb",
    "proof_class": "stage08-structural-audit",
    "binding_status": "current_bound",
    "non_claims": ["Hash binding does not establish semantic truth or fresh generation."]
  }
}
